{"group-clusters":[],"base-clusters":{"x":[],"y":[],"id":[],"count":[],"members":[]},"group-votes":{},"group-aware-consensus":{},"user-vote-counts":{},"in-conv":[],"n-cmts":0,"pca":{"comps":[[],[]],"center":[0,0],"comment-extremity":[],"comment-projection":{}},"tids":[],"n":0,"repness":{},"consensus":{"agree":[],"disagree":[]},"votes-base":{},"lastModTimestamp":null,"lastVoteTimestamp":1700000000000,"comment-priorities":{},"math_tick":0}